{
  "$schema": "https://json-schema.org/draft/2020-12/schema",
  "$id": "https://kappa-box.invalid/schemas/inventory.schema.json",
  "title": "kappa-box read-only inventory record v1",
  "description": "The bounded, non-accepting output of the first host inventory probe.",
  "type": "object",
  "additionalProperties": false,
  "required": [
    "profileId",
    "collectedAt",
    "acceptance",
    "probeStatus",
    "probeSuiteVersion",
    "sourceCommit",
    "facts",
    "factsDigest",
    "pins",
    "failureGroups",
    "commands"
  ],
  "properties": {
    "profileId": {
      "type": "string",
      "pattern": "^[a-z][a-z0-9-]*:(?:l[123]|managed|obs)(?:@[a-z0-9][a-z0-9._-]*)?$"
    },
    "collectedAt": {
      "type": "string",
      "format": "date-time",
      "pattern": "^\\d{4}-\\d{2}-\\d{2}T\\d{2}:\\d{2}:\\d{2}(?:\\.\\d+)?(?:Z|[+-]\\d{2}:\\d{2})$"
    },
    "acceptance": {
      "const": "unverified"
    },
    "probeStatus": {
      "const": "inventory_only"
    },
    "probeSuiteVersion": {
      "type": "string",
      "minLength": 1,
      "maxLength": 128
    },
    "sourceCommit": {
      "type": "string",
      "minLength": 1,
      "maxLength": 128
    },
    "facts": {
      "type": "null"
    },
    "factsDigest": {
      "type": "null"
    },
    "pins": {
      "type": "null"
    },
    "failureGroups": {
      "type": "array",
      "maxItems": 0
    },
    "commands": {
      "type": "array",
      "minItems": 1,
      "items": {
        "type": "object",
        "additionalProperties": false,
        "required": ["name", "argv", "returncode", "timed_out"],
        "properties": {
          "name": {
            "type": "string",
            "minLength": 1,
            "maxLength": 128
          },
          "argv": {
            "type": "array",
            "minItems": 1,
            "items": {
              "type": "string",
              "maxLength": 4096
            }
          },
          "returncode": {
            "type": "integer"
          },
          "stdout": {
            "type": "string"
          },
          "stderr": {
            "type": "string"
          },
          "duration_ms": {
            "type": "integer",
            "minimum": 0
          },
          "timed_out": {
            "type": "boolean"
          }
        }
      }
    }
  }
}
